{"regression_id":"PPR-REG-0001","reported_at":"2026-08-14T00:00:00Z","reported_by":"owner","source":"evaluation","summary":"","affected_rule_ids":[],"fixture_ids":[],"severity":"medium","status":"new","owner":"","expected_behavior":"","observed_behavior":"","decision_hook_ids":[],"retest_required":true,"retest_result":null,"closed_at":null}
